{
  "format": "x2d-rig-v2",
  "meta": {
    "character": "template",
    "provenance": "replace with real source and rights information"
  },
  "canvas": {"width": 1080, "height": 1920},
  "bones": [
    {"id":"root","parent":null,"x":540,"y":1200,"rotation":0,"length":0},
    {"id":"pelvis","parent":"root","x":0,"y":0,"rotation":-90,"length":160},
    {"id":"spine","parent":"pelvis","x":160,"y":0,"rotation":0,"length":210},
    {"id":"neck","parent":"spine","x":210,"y":0,"rotation":0,"length":70},
    {"id":"head","parent":"neck","x":70,"y":0,"rotation":0,"length":0},
    {"id":"upper_arm_l","parent":"spine","x":160,"y":-85,"rotation":-125,"length":170},
    {"id":"forearm_l","parent":"upper_arm_l","x":170,"y":0,"rotation":-15,"length":160},
    {"id":"hand_l","parent":"forearm_l","x":160,"y":0,"rotation":0,"length":0},
    {"id":"upper_arm_r","parent":"spine","x":160,"y":85,"rotation":125,"length":170},
    {"id":"forearm_r","parent":"upper_arm_r","x":170,"y":0,"rotation":15,"length":160},
    {"id":"hand_r","parent":"forearm_r","x":160,"y":0,"rotation":0,"length":0},
    {"id":"thigh_l","parent":"pelvis","x":0,"y":-55,"rotation":80,"length":240},
    {"id":"calf_l","parent":"thigh_l","x":240,"y":0,"rotation":10,"length":230},
    {"id":"foot_l","parent":"calf_l","x":230,"y":0,"rotation":0,"length":0},
    {"id":"thigh_r","parent":"pelvis","x":0,"y":55,"rotation":100,"length":240},
    {"id":"calf_r","parent":"thigh_r","x":240,"y":0,"rotation":-10,"length":230},
    {"id":"foot_r","parent":"calf_r","x":230,"y":0,"rotation":0,"length":0}
  ],
  "slots": [],
  "attachments": {},
  "constraints": [
    {"id":"ik_leg_l","type":"ik2","bones":["thigh_l","calf_l"],"target":"foot_l","mix":1.0},
    {"id":"ik_leg_r","type":"ik2","bones":["thigh_r","calf_r"],"target":"foot_r","mix":1.0}
  ],
  "skins": {"default":{}},
  "animations": {
    "idle":{"duration":3.0,"bones":{},"slots":{},"deform":{},"constraints":{},"drawOrder":[],"events":[]},
    "walk":{"duration":1.0,"bones":{},"slots":{},"deform":{},"constraints":{},"drawOrder":[],"events":[]}
  }
}
